{
  "$schema": "https://json-schema.org/draft/2020-12/schema",
  "$id": "https://controls.local/schema-files/method-control-channel-policy.schema.json",
  "title": "Reviewed Local Method Control Channel Policy",
  "type": "object", "additionalProperties": false,
  "required": ["schema_version", "type", "transport", "identity_assurance", "runtime_sha256", "max_requests", "max_validity_seconds", "request_validity_seconds", "output_max_bytes"],
  "properties": {
    "schema_version": { "const": "0.1" }, "type": { "const": "MethodControlChannelPolicy" },
    "transport": { "const": "mcp_stdio_reference" },
    "identity_assurance": { "const": "local_operator_enrollment_reference" },
    "runtime_sha256": { "$ref": "common.schema.json#/$defs/sha256" },
    "max_requests": { "type": "integer", "minimum": 1, "maximum": 128 },
    "max_validity_seconds": { "type": "integer", "minimum": 1, "maximum": 3600 },
    "request_validity_seconds": { "type": "integer", "minimum": 1, "maximum": 60 },
    "output_max_bytes": { "type": "integer", "minimum": 4096, "maximum": 262144 }
  }
}
