{
  "schema_version": "0.1",
  "type": "MethodControlChannelPolicy",
  "transport": "mcp_stdio_reference",
  "identity_assurance": "local_operator_enrollment_reference",
  "runtime_sha256": "24a565f2b8080713f0cba4dec1ee4e459b58e17780d3417913ceede601ce6bea",
  "max_requests": 32,
  "max_validity_seconds": 600,
  "request_validity_seconds": 30,
  "output_max_bytes": 65536
}
